{
  "schema_version": "3.0.0",
  "scope": {
    "tenant_id": "fixture-tenant",
    "project_id": "fixture-amplai"
  },
  "run_id": "fixture-run-id",
  "work_id": "fixture-work-id",
  "node_id": "fixture-node-id",
  "attempt": 1,
  "contract_ref": {
    "id": "fixture-ref",
    "revision": 1,
    "digest": "sha256:bc87b130fe6e2fb0156bdda50d7d14562db83b58199490694266def47b41773d"
  },
  "graph_ref": {
    "id": "fixture-ref",
    "revision": 1,
    "digest": "sha256:bc87b130fe6e2fb0156bdda50d7d14562db83b58199490694266def47b41773d"
  },
  "context_bundle_ref": {
    "id": "fixture-ref",
    "revision": 1,
    "digest": "sha256:bc87b130fe6e2fb0156bdda50d7d14562db83b58199490694266def47b41773d"
  },
  "composition_ref": {
    "id": "fixture-ref",
    "revision": 1,
    "digest": "sha256:bc87b130fe6e2fb0156bdda50d7d14562db83b58199490694266def47b41773d"
  },
  "sandbox_ref": {
    "id": "fixture-ref",
    "revision": 1,
    "digest": "sha256:bc87b130fe6e2fb0156bdda50d7d14562db83b58199490694266def47b41773d"
  },
  "grant_ref": {
    "id": "fixture-ref",
    "revision": 1,
    "digest": "sha256:bc87b130fe6e2fb0156bdda50d7d14562db83b58199490694266def47b41773d"
  },
  "lease_id": "fixture-lease-id",
  "fencing_token": 1,
  "policy_generation": 1,
  "expires_at": "2026-09-15T13:30:00Z",
  "budget_reservation_ref": {
    "id": "fixture-ref",
    "revision": 1,
    "digest": "sha256:bc87b130fe6e2fb0156bdda50d7d14562db83b58199490694266def47b41773d"
  },
  "effective_capabilities": []
}
